name,mana_cost,type_line,oracle_text,rarity,set,collector_number
Entropic Battlecruiser,{3}{B},Artifact — Spacecraft,"Station (Tap another creature you control: Put charge counters equal to its power on this Spacecraft. Station only as a sorcery. It's an artifact creature at 8+.)
1+ | Whenever an opponent discards a card, they lose 3 life.
8+ | Flying, deathtouch
Whenever this Spacecraft attacks, each opponent discards a card. Each opponent who can't loses 3 life.",rare,eoe,99
Faller's Faithful,{2}{B},Creature — Human Wizard,"When this creature enters, destroy up to one other target creature. If that creature wasn't dealt damage this turn, its controller draws two cards.",uncommon,eoe,100
Fell Gravship,{2}{B},Artifact — Spacecraft,"When this Spacecraft enters, mill three cards, then return a creature or Spacecraft card from your graveyard to your hand.
Station (Tap another creature you control: Put charge counters equal to its power on this Spacecraft. Station only as a sorcery. It's an artifact creature at 8+.)
8+ | Flying, lifelink",uncommon,eoe,101
Gravblade Heavy,{3}{B},Creature — Human Soldier,"As long as you control an artifact, this creature gets +1/+0 and has deathtouch.",common,eoe,102
Gravkill,{3}{B},Instant,Exile target creature or Spacecraft.,common,eoe,103
Gravpack Monoist,{2}{B},Creature — Human Scout,"Flying
When this creature dies, create a tapped 2/2 colorless Robot artifact creature token.",common,eoe,104
Hullcarver,{B},Artifact Creature — Robot Assassin,Deathtouch,common,eoe,105
Hylderblade,{B},Artifact — Equipment,"Equipped creature gets +3/+1.
Void — At the beginning of your end step, if a nonland permanent left the battlefield this turn or a spell was warped this turn, attach this Equipment to target creature you control.
Equip {4} ({4}: Attach to target creature you control. Equip only as a sorcery.)",uncommon,eoe,106
Hymn of the Faller,{1}{B},Sorcery,"Surveil 1, then you draw a card and lose 1 life. (To surveil 1, look at the top card of your library. You may put it into your graveyard.)
Void — If a nonland permanent left the battlefield this turn or a spell was warped this turn, draw another card.",uncommon,eoe,107
Insatiable Skittermaw,{2}{B},Creature — Insect Horror,"Menace (This creature can't be blocked except by two or more creatures.)
Void — At the beginning of your end step, if a nonland permanent left the battlefield this turn or a spell was warped this turn, put a +1/+1 counter on this creature.",common,eoe,108
Lightless Evangel,{1}{B},Creature — Vampire Cleric,"Whenever you sacrifice another creature or artifact, put a +1/+1 counter on this creature.",uncommon,eoe,109
Monoist Circuit-Feeder,{4}{B}{B},Artifact Creature — Nautilus,"Flying
When this creature enters, until end of turn, target creature you control gets +X/+0 and target creature an opponent controls gets -0/-X, where X is the number of artifacts you control.",uncommon,eoe,110
Monoist Sentry,{B},Artifact Creature — Robot,Defender,uncommon,eoe,111
Perigee Beckoner,{4}{B},Creature — Horror,"When this creature enters, until end of turn, another target creature you control gets +2/+0 and gains ""When this creature dies, return it to the battlefield tapped under its owner's control.""
Warp {1}{B} (You may cast this card from your hand for its warp cost. Exile this creature at the beginning of the next end step, then you may cast it from exile on a later turn.)",common,eoe,112
Requiem Monolith,{2}{B},Artifact,"{T}: Until end of turn, target creature gains ""Whenever this creature is dealt damage, you draw that many cards and lose that much life."" That creature's controller may have this artifact deal 1 damage to it. Activate only as a sorcery.",rare,eoe,113
Scrounge for Eternity,{2}{B},Sorcery,"As an additional cost to cast this spell, sacrifice an artifact or creature.
Return target creature or Spacecraft card with mana value 5 or less from your graveyard to the battlefield. Then create a Lander token. (It's an artifact with ""{2}, {T}, Sacrifice this token: Search your library for a basic land card, put it onto the battlefield tapped, then shuffle."")",uncommon,eoe,114
"Sothera, the Supervoid",{2}{B}{B},Legendary Enchantment,"Whenever a creature you control dies, each opponent chooses a creature they control and exiles it.
At the beginning of your end step, if a player controls no creatures, sacrifice Sothera, then put a creature card exiled with it onto the battlefield under your control with two additional +1/+1 counters on it.",mythic,eoe,115
Sunset Saboteur,{1}{B},Creature — Human Rogue,"Menace
Ward—Discard a card.
Whenever this creature attacks, put a +1/+1 counter on target creature an opponent controls.",rare,eoe,116
Susurian Dirgecraft,{4}{B},Artifact — Spacecraft,"When this Spacecraft enters, each opponent sacrifices a nontoken creature of their choice.
Station (Tap another creature you control: Put charge counters equal to its power on this Spacecraft. Station only as a sorcery. It's an artifact creature at 7+.)
7+ | Flying",uncommon,eoe,117
Susurian Voidborn,{2}{B},Creature — Vampire Soldier,"Whenever this creature or another creature or artifact you control dies, target opponent loses 1 life and you gain 1 life.
Warp {B} (You may cast this card from your hand for its warp cost. Exile this creature at the beginning of the next end step, then you may cast it from exile on a later turn.)",uncommon,eoe,118
Swarm Culler,{3}{B},Creature — Insect Warrior,"Flying
Whenever this creature becomes tapped, you may sacrifice another creature or artifact. If you do, draw a card.",common,eoe,119
Temporal Intervention,{2}{B},Sorcery,"Void — This spell costs {2} less to cast if a nonland permanent left the battlefield this turn or a spell was warped this turn.
Target opponent reveals their hand. You choose a nonland card from it. That player discards that card.",common,eoe,120
Timeline Culler,{B}{B},Creature — Drix Warlock,"Haste
You may cast this card from your graveyard using its warp ability.
Warp—{B}, Pay 2 life. (You may cast this card from your hand or graveyard for its warp cost. If you do, exile this creature at the beginning of the next end step, then you may cast it from exile on a later turn.)",uncommon,eoe,121
Tragic Trajectory,{B},Sorcery,"Target creature gets -2/-2 until end of turn.
Void — That creature gets -10/-10 until end of turn instead if a nonland permanent left the battlefield this turn or a spell was warped this turn.",uncommon,eoe,122
Umbral Collar Zealot,{1}{B},Creature — Human Cleric,Sacrifice another creature or artifact: Surveil 1. (Look at the top card of your library. You may put it into your graveyard.),uncommon,eoe,123
Virus Beetle,{1}{B},Artifact Creature — Insect,"When this creature enters, each opponent discards a card.",common,eoe,124
Voidforged Titan,{4}{B},Artifact Creature — Robot Warrior,"Void — At the beginning of your end step, if a nonland permanent left the battlefield this turn or a spell was warped this turn, you draw a card and lose 1 life.",uncommon,eoe,125
Vote Out,{3}{B},Sorcery,"Convoke (Your creatures can help cast this spell. Each creature you tap while casting this spell pays for {1} or one mana of that creature's color.)
Destroy target creature.",uncommon,eoe,126
"Xu-Ifit, Osteoharmonist",{1}{B}{B},Legendary Creature — Human Wizard,{T}: Return target creature card from your graveyard to the battlefield. It's a Skeleton in addition to its other types and has no abilities. Activate only as a sorcery.,rare,eoe,127
Zero Point Ballad,{X}{B},Sorcery,"Destroy all creatures with toughness X or less. You lose X life. If X is 6 or more, return a creature card put into a graveyard this way to the battlefield under your control.",rare,eoe,128
Bombard,{2}{R},Instant,Bombard deals 4 damage to target creature.,common,eoe,129
Cut Propulsion,{2}{R},Instant,"Target creature deals damage to itself equal to its power. If that creature has flying, it deals twice that much damage to itself instead.",uncommon,eoe,130
Debris Field Crusher,{4}{R},Artifact — Spacecraft,"When this Spacecraft enters, it deals 3 damage to any target.
Station (Tap another creature you control: Put charge counters equal to its power on this Spacecraft. Station only as a sorcery. It's an artifact creature at 8+.)
8+ | Flying
{1}{R}: This Spacecraft gets +2/+0 until end of turn.",uncommon,eoe,131
Devastating Onslaught,{X}{X}{R},Sorcery,Create X tokens that are copies of target artifact or creature you control. Those tokens gain haste until end of turn. Sacrifice them at the beginning of the next end step.,mythic,eoe,132
Drill Too Deep,{1}{R},Instant,"Choose one —
• Put five charge counters on target Spacecraft or Planet you control.
• Destroy target artifact.",common,eoe,133
Frontline War-Rager,{2}{R},Creature — Kavu Soldier,"At the beginning of your end step, if you control two or more tapped creatures, put a +1/+1 counter on this creature.",common,eoe,134
Full Bore,{R},Instant,"Target creature you control gets +3/+2 until end of turn. If that creature was cast for its warp cost, it also gains trample and haste until end of turn.",uncommon,eoe,135
Galvanizing Sawship,{5}{R},Artifact — Spacecraft,"Station (Tap another creature you control: Put charge counters equal to its power on this Spacecraft. Station only as a sorcery. It's an artifact creature at 3+.)
3+ | Flying, haste",uncommon,eoe,136
Invasive Maneuvers,{1}{R},Instant,Invasive Maneuvers deals 3 damage to target creature. It deals 5 damage instead if you control a Spacecraft.,uncommon,eoe,137
Kav Landseeker,{3}{R},Creature — Kavu Soldier,"Menace (This creature can't be blocked except by two or more creatures.)
When this creature enters, create a Lander token. At the beginning of the end step on your next turn, sacrifice that token. (It's an artifact with ""{2}, {T}, Sacrifice this token: Search your library for a basic land card, put it onto the battlefield tapped, then shuffle."")",common,eoe,138
Kavaron Harrier,{R},Artifact Creature — Robot Soldier,"Whenever this creature attacks, you may pay {2}. If you do, create a 2/2 colorless Robot artifact creature token that's tapped and attacking. Sacrifice that token at end of combat.",uncommon,eoe,139
Kavaron Skywarden,{4}{R},Creature — Kavu Soldier,"Reach
Void — At the beginning of your end step, if a nonland permanent left the battlefield this turn or a spell was warped this turn, put a +1/+1 counter on this creature.",common,eoe,140
Kavaron Turbodrone,{2}{R},Artifact Creature — Robot Scout,{T}: Target creature you control gets +1/+1 and gains haste until end of turn. Activate only as a sorcery.,common,eoe,141
Lithobraking,{2}{R},Instant,"Create a Lander token. Then you may sacrifice an artifact. When you do, Lithobraking deals 2 damage to each creature. (A Lander token is an artifact with ""{2}, {T}, Sacrifice this token: Search your library for a basic land card, put it onto the battlefield tapped, then shuffle."")",uncommon,eoe,142
Melded Moxite,{1}{R},Artifact,"When this artifact enters, you may discard a card. If you do, draw two cards.
{3}, Sacrifice this artifact: Create a tapped 2/2 colorless Robot artifact creature token.",common,eoe,143
Memorial Team Leader,{3}{R},Creature — Kavu Soldier,"During your turn, other creatures you control get +1/+0.
Warp {1}{R} (You may cast this card from your hand for its warp cost. Exile this creature at the beginning of the next end step, then you may cast it from exile on a later turn.)",uncommon,eoe,144
Memorial Vault,{3}{R},Artifact,"{T}, Sacrifice another artifact: Exile the top X cards of your library, where X is one plus the mana value of the sacrificed artifact. You may play those cards this turn.",rare,eoe,145
Molecular Modifier,{2}{R},Creature — Kavu Artificer,"At the beginning of combat on your turn, target creature you control gets +1/+0 and gains first strike until end of turn.",uncommon,eoe,146
Nebula Dragon,{6}{R},Creature — Dragon,"Flying
When this creature enters, it deals 3 damage to any target.",common,eoe,147
Nova Hellkite,{3}{R}{R},Creature — Dragon,"Flying, haste
When this creature enters, it deals 1 damage to target creature an opponent controls.
Warp {2}{R} (You may cast this card from your hand for its warp cost. Exile this creature at the beginning of the next end step, then you may cast it from exile on a later turn.)",rare,eoe,148
Orbital Plunge,{3}{R},Sorcery,"Orbital Plunge deals 6 damage to target creature. If excess damage was dealt this way, create a Lander token. (It's an artifact with ""{2}, {T}, Sacrifice this token: Search your library for a basic land card, put it onto the battlefield tapped, then shuffle."")",common,eoe,149
Oreplate Pangolin,{1}{R},Artifact Creature — Robot Pangolin,"Whenever another artifact you control enters, you may pay {1}. If you do, put a +1/+1 counter on this creature.",common,eoe,150
Pain for All,{2}{R},Enchantment — Aura,"Enchant creature you control
When this Aura enters, enchanted creature deals damage equal to its power to any other target.
Whenever enchanted creature is dealt damage, it deals that much damage to each opponent.",rare,eoe,151
Plasma Bolt,{R},Sorcery,"Plasma Bolt deals 2 damage to any target.
Void — Plasma Bolt deals 3 damage instead if a nonland permanent left the battlefield this turn or a spell was warped this turn.",common,eoe,152
Possibility Technician,{2}{R},Creature — Kavu Artificer,"Whenever this creature or another Kavu you control enters, exile the top card of your library. For as long as that card remains exiled, you may play it if you control a Kavu.
Warp {1}{R} (You may cast this card from your hand for its warp cost. Exile this creature at the beginning of the next end step, then you may cast it from exile on a later turn.)",rare,eoe,153
Red Tiger Mechan,{3}{R},Artifact Creature — Robot Cat,"Haste
Warp {1}{R} (You may cast this card from your hand for its warp cost. Exile this creature at the beginning of the next end step, then you may cast it from exile on a later turn.)",common,eoe,154
Remnant Elemental,{1}{R},Creature — Elemental,"Reach
Landfall — Whenever a land you control enters, this creature gets +2/+0 until end of turn.",uncommon,eoe,155
Rig for War,{1}{R},Instant,Target creature gets +3/+0 and gains first strike and reach until end of turn.,common,eoe,156
Roving Actuator,{3}{R},Artifact Creature — Robot,"Void — When this creature enters, if a nonland permanent left the battlefield this turn or a spell was warped this turn, exile up to one target instant or sorcery card with mana value 2 or less from your graveyard. Copy it. You may cast the copy without paying its mana cost.",uncommon,eoe,157
Ruinous Rampage,{1}{R}{R},Sorcery,"Choose one —
• Ruinous Rampage deals 3 damage to each opponent.
• Exile all artifacts with mana value 3 or less.",uncommon,eoe,158
Rust Harvester,{R},Artifact Creature — Robot,"Menace
{2}, {T}, Exile an artifact card from your graveyard: Put a +1/+1 counter on this creature, then it deals damage equal to its power to any target.",rare,eoe,159
Slagdrill Scrapper,{R},Artifact Creature — Robot Scout,"{2}, {T}, Sacrifice another artifact or land: Draw a card.",common,eoe,160
Systems Override,{2}{R},Sorcery,"Gain control of target artifact or creature until end of turn. Untap that permanent. It gains haste until end of turn. If it's a Spacecraft, put ten charge counters on it. If you do, remove ten charge counters from it at the beginning of the next end step.",uncommon,eoe,161
"Tannuk, Steadfast Second",{2}{R}{R},Legendary Creature — Kavu Pilot,"Other creatures you control have haste.
Artifact cards and red creature cards in your hand have warp {2}{R}. (You may cast a card from your hand for its warp cost. Exile that permanent at the beginning of the next end step, then you may cast it from exile on a later turn.)",mythic,eoe,162
Terminal Velocity,{4}{R}{R},Sorcery,"You may put an artifact or creature card from your hand onto the battlefield. That permanent gains haste, ""When this permanent leaves the battlefield, it deals damage equal to its mana value to each creature,"" and ""At the beginning of your end step, sacrifice this permanent.""",rare,eoe,163
Terrapact Intimidator,{1}{R},Creature — Kavu Scout,"When this creature enters, target opponent may have you create two Lander tokens. If they don't, put two +1/+1 counters on this creature. (A Lander token is an artifact with ""{2}, {T}, Sacrifice this token: Search your library for a basic land card, put it onto the battlefield tapped, then shuffle."")",uncommon,eoe,164
Territorial Bruntar,{4}{R}{R},Creature — Beast,"Reach
Landfall — Whenever a land you control enters, exile cards from the top of your library until you exile a nonland card. You may cast that card this turn.",uncommon,eoe,165
Vaultguard Trooper,{4}{R},Creature — Kavu Soldier,"At the beginning of your end step, if you control two or more tapped creatures, you may discard your hand. If you do, draw two cards.",uncommon,eoe,166
Warmaker Gunship,{2}{R},Artifact — Spacecraft,"When this Spacecraft enters, it deals damage equal to the number of artifacts you control to target creature an opponent controls.
Station (Tap another creature you control: Put charge counters equal to its power on this Spacecraft. Station only as a sorcery. It's an artifact creature at 6+.)
6+ | Flying",rare,eoe,167
Weapons Manufacturing,{1}{R},Enchantment,"Whenever a nontoken artifact you control enters, create a colorless artifact token named Munitions with ""When this token leaves the battlefield, it deals 2 damage to any target.""",rare,eoe,168
Weftstalker Ardent,{2}{R},Creature — Drix Artificer,"Whenever another creature or artifact you control enters, this creature deals 1 damage to each opponent.
Warp {R} (You may cast this card from your hand for its warp cost. Exile this creature at the beginning of the next end step, then you may cast it from exile on a later turn.)",uncommon,eoe,169
Zookeeper Mechan,{1}{R},Artifact Creature — Robot,"{T}: Add {R}.
{6}{R}: Target creature you control gets +4/+0 until end of turn. Activate only as a sorcery.",common,eoe,170
Atmospheric Greenhouse,{4}{G},Artifact — Spacecraft,"When this Spacecraft enters, put a +1/+1 counter on each creature you control.
Station (Tap another creature you control: Put charge counters equal to its power on this Spacecraft. Station only as a sorcery. It's an artifact creature at 8+.)
8+ | Flying, trample",uncommon,eoe,171
Bioengineered Future,{1}{G}{G},Enchantment,"When this enchantment enters, create a Lander token. (It's an artifact with ""{2}, {T}, Sacrifice this token: Search your library for a basic land card, put it onto the battlefield tapped, then shuffle."")
Each creature you control enters with an additional +1/+1 counter on it for each land that entered the battlefield under your control this turn.",rare,eoe,172
Biosynthic Burst,{1}{G},Instant,"Put a +1/+1 counter on target creature you control. It gains reach, trample, and indestructible until end of turn. Untap it. (Damage and effects that say ""destroy"" don't destroy it.)",common,eoe,173
Blooming Stinger,{1}{G},Creature — Plant Scorpion,"Deathtouch
When this creature enters, another target creature you control gains deathtouch until end of turn.",common,eoe,174
Broodguard Elite,{X}{G}{G},Creature — Insect Knight,"This creature enters with X +1/+1 counters on it.
When this creature leaves the battlefield, put its counters on target creature you control.
Warp {X}{G} (You may cast this card from your hand for its warp cost. Exile this creature at the beginning of the next end step, then you may cast it from exile on a later turn.)",uncommon,eoe,175
Close Encounter,{1}{G},Instant,"As an additional cost to cast this spell, choose a creature you control or a warped creature card you own in exile.
Close Encounter deals damage equal to the power of the chosen creature or card to target creature.",uncommon,eoe,176
Diplomatic Relations,{2}{G},Instant,Target creature you control gets +1/+0 and gains vigilance until end of turn. It deals damage equal to its power to target creature an opponent controls.,common,eoe,177
Drix Fatemaker,{3}{G},Creature — Drix Wizard,"When this creature enters, put a +1/+1 counter on target creature.
Each creature you control with a +1/+1 counter on it has trample.
Warp {1}{G} (You may cast this card from your hand for its warp cost. Exile this creature at the beginning of the next end step, then you may cast it from exile on a later turn.)",common,eoe,178
Edge Rover,{G},Artifact Creature — Robot Scout,"Reach
When this creature dies, each player creates a Lander token. (It's an artifact with ""{2}, {T}, Sacrifice this token: Search your library for a basic land card, put it onto the battlefield tapped, then shuffle."")",uncommon,eoe,179
Eumidian Terrabotanist,{1}{G},Creature — Insect Druid,"Landfall — Whenever a land you control enters, you gain 1 life.",uncommon,eoe,180
Eusocial Engineering,{3}{G}{G},Enchantment,"Landfall — Whenever a land you control enters, create a 2/2 colorless Robot artifact creature token.
Warp {1}{G} (You may cast this card from your hand for its warp cost. Exile this enchantment at the beginning of the next end step, then you may cast it from exile on a later turn.)",uncommon,eoe,181
Famished Worldsire,{5}{G}{G}{G},Creature — Leviathan,"Ward {3}
Devour land 3 (As this creature enters, you may sacrifice any number of lands. It enters with three times that many +1/+1 counters on it.)
When this creature enters, look at the top X cards of your library, where X is this creature's power. Put any number of land cards from among them onto the battlefield tapped, then shuffle.",mythic,eoe,182
Frenzied Baloth,{G}{G},Creature — Beast,"This spell can't be countered.
Trample, haste
Creature spells you control can't be countered.
Combat damage can't be prevented.",rare,eoe,183
Fungal Colossus,{6}{G},Creature — Fungus Beast,"This spell costs {X} less to cast, where X is the number of differently named lands you control.",common,eoe,184
Galactic Wayfarer,{2}{G},Creature — Human Scout,"When this creature enters, create a Lander token. (It's an artifact with ""{2}, {T}, Sacrifice this token: Search your library for a basic land card, put it onto the battlefield tapped, then shuffle."")",common,eoe,185
Gene Pollinator,{G},Artifact Creature — Robot Insect,"{T}, Tap an untapped permanent you control: Add one mana of any color.",common,eoe,186
Germinating Wurm,{4}{G},Creature — Plant Wurm,"When this creature enters, you gain 2 life.
Warp {1}{G} (You may cast this card from your hand for its warp cost. Exile this creature at the beginning of the next end step, then you may cast it from exile on a later turn.)",common,eoe,187
Glacier Godmaw,{5}{G}{G},Creature — Leviathan,"Trample
When this creature enters, create a Lander token. (It's an artifact with ""{2}, {T}, Sacrifice this token: Search your library for a basic land card, put it onto the battlefield tapped, then shuffle."")
Landfall — Whenever a land you control enters, creatures you control get +1/+1 and gain vigilance and haste until end of turn.",uncommon,eoe,188
Harmonious Grovestrider,{3}{G}{G},Creature — Beast,"Ward {2} (Whenever this creature becomes the target of a spell or ability an opponent controls, counter it unless that player pays {2}.)
Harmonious Grovestrider's power and toughness are each equal to the number of lands you control.",uncommon,eoe,189
Hemosymbic Mite,{G},Creature — Mite,"Whenever this creature becomes tapped, another target creature you control gets +X/+X until end of turn, where X is this creature's power.",uncommon,eoe,190
Icecave Crasher,{3}{G},Creature — Beast,"Trample
Landfall — Whenever a land you control enters, this creature gets +1/+0 until end of turn.",common,eoe,191
Icetill Explorer,{2}{G}{G},Creature — Insect Scout,"You may play an additional land on each of your turns.
You may play lands from your graveyard.
Landfall — Whenever a land you control enters, mill a card.",rare,eoe,192
Intrepid Tenderfoot,{1}{G},Creature — Insect Citizen,{3}: Put a +1/+1 counter on this creature. Activate only as a sorcery.,common,eoe,193
Larval Scoutlander,{2}{G},Artifact — Spacecraft,"When this Spacecraft enters, you may sacrifice a land or Lander. If you do, search your library for up to two basic land cards, put them onto the battlefield tapped, then shuffle.
Station (Tap another creature you control: Put charge counters equal to its power on this Spacecraft. Station only as a sorcery. It's an artifact creature at 7+.)
7+ | Flying",uncommon,eoe,194
Lashwhip Predator,{4}{G}{G},Creature — Plant Beast,"This spell costs {2} less to cast if your opponents control three or more creatures.
Reach",uncommon,eoe,195
Loading Zone,{3}{G},Enchantment,"If one or more counters would be put on a creature, Spacecraft, or Planet you control, twice that many of each of those kinds of counters are put on it instead.
Warp {G} (You may cast this card from your hand for its warp cost. Exile this enchantment at the beginning of the next end step, then you may cast it from exile on a later turn.)",rare,eoe,196
Meltstrider Eulogist,{2}{G},Creature — Insect Soldier,"Whenever a creature you control with a +1/+1 counter on it dies, draw a card.",uncommon,eoe,197
Meltstrider's Gear,{G},Artifact — Equipment,"When this Equipment enters, attach it to target creature you control.
Equipped creature gets +2/+1 and has reach.
Equip {5} ({5}: Attach to target creature you control. Equip only as a sorcery.)",common,eoe,198
Meltstrider's Resolve,{G},Enchantment — Aura,"Enchant creature you control
When this Aura enters, enchanted creature fights up to one target creature an opponent controls. (Each deals damage equal to its power to the other.)
Enchanted creature gets +0/+2 and can't be blocked by more than one creature.",uncommon,eoe,199
