name,mana_cost,type_line,oracle_text,rarity,set,collector_number
Mightform Harmonizer,{2}{G}{G},Creature — Insect Druid,"Landfall — Whenever a land you control enters, double the power of target creature you control until end of turn.
Warp {2}{G} (You may cast this card from your hand for its warp cost. Exile this creature at the beginning of the next end step, then you may cast it from exile on a later turn.)",rare,eoe,200
Ouroboroid,{2}{G}{G},Creature — Plant Wurm,"At the beginning of combat on your turn, put X +1/+1 counters on each creature you control, where X is this creature's power.",mythic,eoe,201
Pull Through the Weft,{3}{G}{G},Sorcery,"Return up to two target nonland permanent cards from your graveyard to your hand, then return up to two target land cards from your graveyard to the battlefield tapped.",uncommon,eoe,202
Sami's Curiosity,{G},Sorcery,"You gain 2 life. Create a Lander token. (It's an artifact with ""{2}, {T}, Sacrifice this token: Search your library for a basic land card, put it onto the battlefield tapped, then shuffle."")",common,eoe,203
Seedship Agrarian,{3}{G},Creature — Insect Scientist,"Whenever this creature becomes tapped, create a Lander token. (It's an artifact with ""{2}, {T}, Sacrifice this token: Search your library for a basic land card, put it onto the battlefield tapped, then shuffle."")
Landfall — Whenever a land you control enters, put a +1/+1 counter on this creature.",uncommon,eoe,204
Seedship Impact,{1}{G},Instant,"Destroy target artifact or enchantment. If its mana value was 2 or less, create a Lander token. (It's an artifact with ""{2}, {T}, Sacrifice this token: Search your library for a basic land card, put it onto the battlefield tapped, then shuffle."")",uncommon,eoe,205
Shattered Wings,{2}{G},Sorcery,"Destroy target artifact, enchantment, or creature with flying. Surveil 1. (Look at the top card of your library. You may put it into your graveyard.)",common,eoe,206
Skystinger,{2}{G},Creature — Insect Warrior,"Reach
Whenever this creature blocks a creature with flying, this creature gets +5/+0 until end of turn.",common,eoe,207
Sledge-Class Seedship,{2}{G},Artifact — Spacecraft,"Station (Tap another creature you control: Put charge counters equal to its power on this Spacecraft. Station only as a sorcery. It's an artifact creature at 7+.)
7+ | Flying
Whenever this Spacecraft attacks, you may put a creature card from your hand onto the battlefield.",rare,eoe,208
Tapestry Warden,{3}{G},Artifact Creature — Robot Soldier,"Vigilance
Each creature you control with toughness greater than its power assigns combat damage equal to its toughness rather than its power.
Each creature you control with toughness greater than its power stations permanents using its toughness rather than its power.",uncommon,eoe,209
Terrasymbiosis,{2}{G},Enchantment,"Whenever you put one or more +1/+1 counters on a creature you control, you may draw that many cards. Do this only once each turn.",rare,eoe,210
Thawbringer,{2}{G},Creature — Insect Scout,"When this creature enters or dies, surveil 1. (Look at the top card of your library. You may put it into your graveyard.)",common,eoe,211
"Alpharael, Dreaming Acolyte",{1}{U}{B},Legendary Creature — Human Cleric,"When Alpharael enters, draw two cards. Then discard two cards unless you discard an artifact card.
During your turn, Alpharael has deathtouch.",uncommon,eoe,212
Biomechan Engineer,{G}{U},Creature — Insect Artificer,"When this creature enters, create a Lander token. (It's an artifact with ""{2}, {T}, Sacrifice this token: Search your library for a basic land card, put it onto the battlefield tapped, then shuffle."")
{8}: Draw two cards and create a 2/2 colorless Robot artifact creature token.",uncommon,eoe,213
Biotech Specialist,{R}{G},Creature — Insect Scientist,"When this creature enters, create a Lander token. (It's an artifact with ""{2}, {T}, Sacrifice this token: Search your library for a basic land card, put it onto the battlefield tapped, then shuffle."")
Whenever you sacrifice an artifact, this creature deals 2 damage to target opponent.",rare,eoe,214
Cosmogoyf,{B}{G},Creature — Elemental Lhurgoyf,Cosmogoyf's power is equal to the number of cards you own in exile and its toughness is equal to that number plus 1.,rare,eoe,215
"Dyadrine, Synthesis Amalgam",{X}{G}{W},Legendary Artifact Creature — Construct,"Trample
Dyadrine enters with a number of +1/+1 counters on it equal to the amount of mana spent to cast it.
Whenever you attack, you may remove a +1/+1 counter from each of two creatures you control. If you do, draw a card and create a 2/2 colorless Robot artifact creature token.",rare,eoe,216
Genemorph Imago,{G}{U},Creature — Insect Druid,"Flying
Landfall — Whenever a land you control enters, target creature has base power and toughness 3/3 until end of turn. If you control six or more lands, that creature has base power and toughness 6/6 until end of turn instead.",rare,eoe,217
"Haliya, Ascendant Cadet",{2}{G}{W}{W},Legendary Creature — Human Soldier,"Whenever Haliya enters or attacks, put a +1/+1 counter on target creature you control.
Whenever one or more creatures you control with +1/+1 counters on them deal combat damage to a player, draw a card.",uncommon,eoe,218
Infinite Guideline Station,{W}{U}{B}{R}{G},Legendary Artifact — Spacecraft,"When Infinite Guideline Station enters, create a tapped 2/2 colorless Robot artifact creature token for each multicolored permanent you control.
Station (Tap another creature you control: Put charge counters equal to its power on this Spacecraft. Station only as a sorcery. It's an artifact creature at 12+.)
12+ | Flying
Whenever Infinite Guideline Station attacks, draw a card for each multicolored permanent you control.",rare,eoe,219
Interceptor Mechan,{2}{B}{R},Artifact Creature — Robot,"Flying
When this creature enters, return target artifact or creature card from your graveyard to your hand.
Void — At the beginning of your end step, if a nonland permanent left the battlefield this turn or a spell was warped this turn, put a +1/+1 counter on this creature.",uncommon,eoe,220
"Mm'menon, Uthros Exile",{1}{U}{R},Legendary Creature — Jellyfish Advisor,"Flying
Whenever an artifact you control enters, put a +1/+1 counter on target creature.",uncommon,eoe,221
Mutinous Massacre,{3}{B}{B}{R}{R},Sorcery,Choose odd or even. Destroy each creature with mana value of the chosen quality. Then gain control of all creatures until end of turn. Untap them. They gain haste until end of turn. (Zero is even.),rare,eoe,222
Pinnacle Emissary,{1}{U}{R},Artifact Creature — Robot,"Whenever you cast an artifact spell, create a 1/1 colorless Drone artifact creature token with flying and ""This token can block only creatures with flying.""
Warp {U/R} (You may cast this card from your hand for its warp cost. Exile this creature at the beginning of the next end step, then you may cast it from exile on a later turn.)",rare,eoe,223
"Ragost, Deft Gastronaut",{R}{W},Legendary Creature — Lobster Citizen,"Artifacts you control are Foods in addition to their other types and have ""{2}, {T}, Sacrifice this artifact: You gain 3 life.""
{1}, {T}, Sacrifice a Food: Ragost deals 3 damage to each opponent.
At the beginning of each end step, if you gained life this turn, untap Ragost.",rare,eoe,224
"Sami, Ship's Engineer",{2}{R}{W},Legendary Creature — Human Artificer,"At the beginning of your end step, if you control two or more tapped creatures, create a tapped 2/2 colorless Robot artifact creature token.",uncommon,eoe,225
"Sami, Wildcat Captain",{4}{R}{W},Legendary Creature — Human Artificer Rogue,"Double strike, vigilance
Spells you cast have affinity for artifacts. (They cost {1} less to cast for each artifact you control.)",mythic,eoe,226
Seedship Broodtender,{B}{G},Creature — Insect Citizen,"When this creature enters, mill three cards. (Put the top three cards of your library into your graveyard.)
{3}{B}{G}, Sacrifice this creature: Return target creature or Spacecraft card from your graveyard to the battlefield. Activate only as a sorcery.",uncommon,eoe,227
Singularity Rupture,{3}{U}{B}{B},Sorcery,"Destroy all creatures, then any number of target players each mill half their library, rounded down.",rare,eoe,228
Space-Time Anomaly,{2}{W}{U},Sorcery,Target player mills cards equal to your life total.,rare,eoe,229
Station Monitor,{W}{U},Creature — Lizard Artificer,"Whenever you cast your second spell each turn, create a 1/1 colorless Drone artifact creature token with flying and ""This token can block only creatures with flying.""",uncommon,eoe,230
"Syr Vondam, Sunstar Exemplar",{W}{B},Legendary Creature — Human Knight,"Vigilance, menace
Whenever another creature you control dies or is put into exile, put a +1/+1 counter on Syr Vondam and you gain 1 life.
When Syr Vondam dies or is put into exile while its power is 4 or greater, destroy up to one target nonland permanent.",rare,eoe,231
"Syr Vondam, the Lucent",{2}{W}{B}{B},Legendary Creature — Human Knight,"Deathtouch, lifelink
Whenever Syr Vondam enters or attacks, other creatures you control get +1/+0 and gain deathtouch until end of turn.",uncommon,eoe,232
"Tannuk, Memorial Ensign",{1}{R}{G},Legendary Creature — Kavu Pilot,"Landfall — Whenever a land you control enters, Tannuk deals 1 damage to each opponent. If this is the second time this ability has resolved this turn, draw a card.",uncommon,eoe,233
All-Fates Scroll,{3},Artifact,"{T}: Add one mana of any color.
{7}, {T}, Sacrifice this artifact: Draw X cards, where X is the number of differently named lands you control.",uncommon,eoe,234
Bygone Colossus,{9},Artifact Creature — Robot Giant,"Warp {3} (You may cast this card from your hand for its warp cost. Exile this creature at the beginning of the next end step, then you may cast it from exile on a later turn.)",uncommon,eoe,235
Chrome Companion,{2},Artifact Creature — Dog,"Whenever this creature becomes tapped, you gain 1 life.
{2}, {T}: Put target card from a graveyard on the bottom of its owner's library.",common,eoe,236
Dauntless Scrapbot,{3},Artifact Creature — Robot,"When this creature enters, exile each opponent's graveyard. Create a Lander token. (It's an artifact with ""{2}, {T}, Sacrifice this token: Search your library for a basic land card, put it onto the battlefield tapped, then shuffle."")",uncommon,eoe,237
"Dawnsire, Sunstar Dreadnought",{5},Legendary Artifact — Spacecraft,"Station (Tap another creature you control: Put charge counters equal to its power on this Spacecraft. Station only as a sorcery. It's an artifact creature at 20+.)
10+ | Whenever you attack, Dawnsire deals 100 damage to up to one target creature or planeswalker.
20+ | Flying",mythic,eoe,238
The Dominion Bracelet,{2},Legendary Artifact — Equipment,"Equipped creature gets +1/+1 and has ""{15}, Exile The Dominion Bracelet: You control target opponent during their next turn. This ability costs {X} less to activate, where X is this creature's power. Activate only as a sorcery."" (You see all cards that player could see and make all decisions for them.)
Equip {1}",mythic,eoe,239
The Endstone,{7},Legendary Artifact,"Whenever you play a land or cast a spell, draw a card.
At the beginning of your end step, your life total becomes half your starting life total, rounded up.",mythic,eoe,240
The Eternity Elevator,{5},Legendary Artifact — Spacecraft,"{T}: Add {C}{C}{C}.
Station (Tap another creature you control: Put charge counters equal to its power on this Spacecraft. Station only as a sorcery.)
20+ | {T}: Add X mana of any one color, where X is the number of charge counters on The Eternity Elevator.",rare,eoe,241
Extinguisher Battleship,{8},Artifact — Spacecraft,"When this Spacecraft enters, destroy target noncreature permanent. Then this Spacecraft deals 4 damage to each creature.
Station (Tap another creature you control: Put charge counters equal to its power on this Spacecraft. Station only as a sorcery. It's an artifact creature at 5+.)
5+ | Flying, trample",rare,eoe,242
Nutrient Block,{1},Artifact — Food,"Indestructible (Effects that say ""destroy"" don't destroy this artifact.)
{2}, {T}, Sacrifice this artifact: You gain 3 life.
When this artifact is put into a graveyard from the battlefield, draw a card.",common,eoe,243
Pinnacle Kill-Ship,{7},Artifact — Spacecraft,"When this Spacecraft enters, it deals 10 damage to up to one target creature.
Station (Tap another creature you control: Put charge counters equal to its power on this Spacecraft. Station only as a sorcery. It's an artifact creature at 7+.)
7+ | Flying",common,eoe,244
Survey Mechan,{4},Artifact Creature — Robot,"Flying
Hexproof (This creature can't be the target of spells or abilities your opponents control.)
{10}, Sacrifice this creature: It deals 3 damage to any target. Target player draws three cards and gains 3 life. This ability costs {X} less to activate, where X is the number of differently named lands you control.",uncommon,eoe,245
Thaumaton Torpedo,{1},Artifact,"{6}, {T}, Sacrifice this artifact: Destroy target nonland permanent. This ability costs {3} less to activate if you attacked with a Spacecraft this turn.",common,eoe,246
Thrumming Hivepool,{6},Artifact,"Affinity for Slivers (This spell costs {1} less to cast for each Sliver you control.)
Slivers you control have double strike and haste.
At the beginning of your upkeep, create two 1/1 colorless Sliver creature tokens.",rare,eoe,247
Virulent Silencer,{3},Artifact Creature — Robot Assassin,"Whenever a nontoken artifact creature you control deals combat damage to a player, that player gets two poison counters. (A player with ten or more poison counters loses the game.)",uncommon,eoe,248
Wurmwall Sweeper,{2},Artifact — Spacecraft,"When this Spacecraft enters, surveil 2.
Station (Tap another creature you control: Put charge counters equal to its power on this Spacecraft. Station only as a sorcery. It's an artifact creature at 4+.)
4+ | Flying",common,eoe,249
"Adagia, Windswept Bastion",,Land — Planet,"This land enters tapped.
{T}: Add {W}.
Station (Tap another creature you control: Put charge counters equal to its power on this Planet. Station only as a sorcery.)
12+ | {3}{W}, {T}: Create a token that's a copy of target artifact or enchantment you control, except it's legendary. Activate only as a sorcery.",mythic,eoe,250
Breeding Pool,,Land — Forest Island,"({T}: Add {G} or {U}.)
As this land enters, you may pay 2 life. If you don't, it enters tapped.",rare,eoe,251
Command Bridge,,Land,"This land enters tapped.
When this land enters, sacrifice it unless you tap an untapped permanent you control.
{T}: Add one mana of any color.",common,eoe,252
"Evendo, Waking Haven",,Land — Planet,"This land enters tapped.
{T}: Add {G}.
Station (Tap another creature you control: Put charge counters equal to its power on this Planet. Station only as a sorcery.)
12+ | {G}, {T}: Add {G} for each creature you control.",mythic,eoe,253
Godless Shrine,,Land — Plains Swamp,"({T}: Add {W} or {B}.)
As this land enters, you may pay 2 life. If you don't, it enters tapped.",rare,eoe,254
"Kavaron, Memorial World",,Land — Planet,"This land enters tapped.
{T}: Add {R}.
Station (Tap another creature you control: Put charge counters equal to its power on this Planet. Station only as a sorcery.)
12+ | {1}{R}, {T}, Sacrifice a land: Create a 2/2 colorless Robot artifact creature token, then creatures you control get +1/+0 and gain haste until end of turn.",mythic,eoe,255
Sacred Foundry,,Land — Mountain Plains,"({T}: Add {R} or {W}.)
As this land enters, you may pay 2 life. If you don't, it enters tapped.",rare,eoe,256
Secluded Starforge,,Land,"{T}: Add {C}.
{2}, {T}, Tap X untapped artifacts you control: Target creature gets +X/+0 until end of turn. Activate only as a sorcery.
{5}, {T}: Create a 2/2 colorless Robot artifact creature token.",rare,eoe,257
Stomping Ground,,Land — Mountain Forest,"({T}: Add {R} or {G}.)
As this land enters, you may pay 2 life. If you don't, it enters tapped.",rare,eoe,258
"Susur Secundi, Void Altar",,Land — Planet,"This land enters tapped.
{T}: Add {B}.
Station (Tap another creature you control: Put charge counters equal to its power on this Planet. Station only as a sorcery.)
12+ | {1}{B}, {T}, Pay 2 life, Sacrifice a creature: Draw cards equal to the sacrificed creature's power. Activate only as a sorcery.",mythic,eoe,259
"Uthros, Titanic Godcore",,Land — Planet,"This land enters tapped.
{T}: Add {U}.
Station (Tap another creature you control: Put charge counters equal to its power on this Planet. Station only as a sorcery.)
12+ | {U}, {T}: Add {U} for each artifact you control.",mythic,eoe,260
Watery Grave,,Land — Island Swamp,"({T}: Add {U} or {B}.)
As this land enters, you may pay 2 life. If you don't, it enters tapped.",rare,eoe,261
Plains,,Basic Land — Plains,({T}: Add {W}.),common,eoe,262
Island,,Basic Land — Island,({T}: Add {U}.),common,eoe,263
Swamp,,Basic Land — Swamp,({T}: Add {B}.),common,eoe,264
Mountain,,Basic Land — Mountain,({T}: Add {R}.),common,eoe,265
Forest,,Basic Land — Forest,({T}: Add {G}.),common,eoe,266
Plains,,Basic Land — Plains,({T}: Add {W}.),common,eoe,267
Plains,,Basic Land — Plains,({T}: Add {W}.),common,eoe,268
Island,,Basic Land — Island,({T}: Add {U}.),common,eoe,269
Island,,Basic Land — Island,({T}: Add {U}.),common,eoe,270
Swamp,,Basic Land — Swamp,({T}: Add {B}.),common,eoe,271
Swamp,,Basic Land — Swamp,({T}: Add {B}.),common,eoe,272
Mountain,,Basic Land — Mountain,({T}: Add {R}.),common,eoe,273
Mountain,,Basic Land — Mountain,({T}: Add {R}.),common,eoe,274
Forest,,Basic Land — Forest,({T}: Add {G}.),common,eoe,275
Forest,,Basic Land — Forest,({T}: Add {G}.),common,eoe,276
"Adagia, Windswept Bastion",,Land — Planet,"This land enters tapped.
{T}: Add {W}.
Station (Tap another creature you control: Put charge counters equal to its power on this Planet. Station only as a sorcery.)
12+ | {3}{W}, {T}: Create a token that's a copy of target artifact or enchantment you control, except it's legendary. Activate only as a sorcery.",mythic,eoe,277
Breeding Pool,,Land — Forest Island,"({T}: Add {G} or {U}.)
As this land enters, you may pay 2 life. If you don't, it enters tapped.",rare,eoe,278
"Evendo, Waking Haven",,Land — Planet,"This land enters tapped.
{T}: Add {G}.
Station (Tap another creature you control: Put charge counters equal to its power on this Planet. Station only as a sorcery.)
12+ | {G}, {T}: Add {G} for each creature you control.",mythic,eoe,279
Godless Shrine,,Land — Plains Swamp,"({T}: Add {W} or {B}.)
As this land enters, you may pay 2 life. If you don't, it enters tapped.",rare,eoe,280
"Kavaron, Memorial World",,Land — Planet,"This land enters tapped.
{T}: Add {R}.
Station (Tap another creature you control: Put charge counters equal to its power on this Planet. Station only as a sorcery.)
12+ | {1}{R}, {T}, Sacrifice a land: Create a 2/2 colorless Robot artifact creature token, then creatures you control get +1/+0 and gain haste until end of turn.",mythic,eoe,281
Sacred Foundry,,Land — Mountain Plains,"({T}: Add {R} or {W}.)
As this land enters, you may pay 2 life. If you don't, it enters tapped.",rare,eoe,282
Stomping Ground,,Land — Mountain Forest,"({T}: Add {R} or {G}.)
As this land enters, you may pay 2 life. If you don't, it enters tapped.",rare,eoe,283
"Susur Secundi, Void Altar",,Land — Planet,"This land enters tapped.
{T}: Add {B}.
Station (Tap another creature you control: Put charge counters equal to its power on this Planet. Station only as a sorcery.)
12+ | {1}{B}, {T}, Pay 2 life, Sacrifice a creature: Draw cards equal to the sacrificed creature's power. Activate only as a sorcery.",mythic,eoe,284
"Uthros, Titanic Godcore",,Land — Planet,"This land enters tapped.
{T}: Add {U}.
Station (Tap another creature you control: Put charge counters equal to its power on this Planet. Station only as a sorcery.)
12+ | {U}, {T}: Add {U} for each artifact you control.",mythic,eoe,285
Watery Grave,,Land — Island Swamp,"({T}: Add {U} or {B}.)
As this land enters, you may pay 2 life. If you don't, it enters tapped.",rare,eoe,286
"Tezzeret, Cruel Captain",{3},Legendary Planeswalker — Tezzeret,"Whenever an artifact you control enters, put a loyalty counter on Tezzeret.
0: Untap target artifact or creature. If it's an artifact creature, put a +1/+1 counter on it.
−3: Search your library for an artifact card with mana value 1 or less, reveal it, put it into your hand, then shuffle.
−7: You get an emblem with ""At the beginning of combat on your turn, put three +1/+1 counters on target artifact you control. If it's not a creature, it becomes a 0/0 Robot artifact creature.""",mythic,eoe,287
Astelli Reclaimer,{3}{W}{W},Creature — Angel Warrior,"Flying
When this creature enters, return target noncreature, nonland permanent card with mana value X or less from your graveyard to the battlefield, where X is the amount of mana spent to cast this creature.
Warp {2}{W}",rare,eoe,288
"Haliya, Guided by Light",{2}{W},Legendary Creature — Human Soldier,"Whenever Haliya or another creature or artifact you control enters, you gain 1 life.
At the beginning of your end step, draw a card if you've gained 3 or more life this turn.
Warp {W} (You may cast this card from your hand for its warp cost. Exile this creature at the beginning of the next end step, then you may cast it from exile on a later turn.)",rare,eoe,289
"Mm'menon, the Right Hand",{3}{U}{U},Legendary Creature — Jellyfish Advisor,"Flying
You may look at the top card of your library any time.
You may cast artifact spells from the top of your library.
Artifacts you control have ""{T}: Add {U}. Spend this mana only to cast a spell from anywhere other than your hand.""",rare,eoe,290
Starwinder,{5}{U}{U},Creature — Leviathan,"Whenever a creature you control deals combat damage to a player, you may draw that many cards.
Warp {2}{U}{U} (You may cast this card from your hand for its warp cost. Exile this creature at the beginning of the next end step, then you may cast it from exile on a later turn.)",rare,eoe,291
"Alpharael, Stonechosen",{3}{B}{B},Legendary Creature — Human Cleric,"Ward—Discard a card at random.
Void — Whenever Alpharael attacks, if a nonland permanent left the battlefield this turn or a spell was warped this turn, defending player loses half their life, rounded up.",mythic,eoe,292
Elegy Acolyte,{2}{B}{B},Creature — Human Cleric,"Lifelink
Whenever one or more creatures you control deal combat damage to a player, you draw a card and lose 1 life.
Void — At the beginning of your end step, if a nonland permanent left the battlefield this turn or a spell was warped this turn, create a 2/2 colorless Robot artifact creature token.",rare,eoe,293
"Xu-Ifit, Osteoharmonist",{1}{B}{B},Legendary Creature — Human Wizard,{T}: Return target creature card from your graveyard to the battlefield. It's a Skeleton in addition to its other types and has no abilities. Activate only as a sorcery.,rare,eoe,294
Possibility Technician,{2}{R},Creature — Kavu Artificer,"Whenever this creature or another Kavu you control enters, exile the top card of your library. For as long as that card remains exiled, you may play it if you control a Kavu.
Warp {1}{R} (You may cast this card from your hand for its warp cost. Exile this creature at the beginning of the next end step, then you may cast it from exile on a later turn.)",rare,eoe,295
"Tannuk, Steadfast Second",{2}{R}{R},Legendary Creature — Kavu Pilot,"Other creatures you control have haste.
Artifact cards and red creature cards in your hand have warp {2}{R}. (You may cast a card from your hand for its warp cost. Exile that permanent at the beginning of the next end step, then you may cast it from exile on a later turn.)",mythic,eoe,296
Mightform Harmonizer,{2}{G}{G},Creature — Insect Druid,"Landfall — Whenever a land you control enters, double the power of target creature you control until end of turn.
Warp {2}{G} (You may cast this card from your hand for its warp cost. Exile this creature at the beginning of the next end step, then you may cast it from exile on a later turn.)",rare,eoe,297
"Dyadrine, Synthesis Amalgam",{X}{G}{W},Legendary Artifact Creature — Construct,"Trample
Dyadrine enters with a number of +1/+1 counters on it equal to the amount of mana spent to cast it.
Whenever you attack, you may remove a +1/+1 counter from each of two creatures you control. If you do, draw a card and create a 2/2 colorless Robot artifact creature token.",rare,eoe,298
Genemorph Imago,{G}{U},Creature — Insect Druid,"Flying
Landfall — Whenever a land you control enters, target creature has base power and toughness 3/3 until end of turn. If you control six or more lands, that creature has base power and toughness 6/6 until end of turn instead.",rare,eoe,299
"Ragost, Deft Gastronaut",{R}{W},Legendary Creature — Lobster Citizen,"Artifacts you control are Foods in addition to their other types and have ""{2}, {T}, Sacrifice this artifact: You gain 3 life.""
{1}, {T}, Sacrifice a Food: Ragost deals 3 damage to each opponent.
At the beginning of each end step, if you gained life this turn, untap Ragost.",rare,eoe,300
"Sami, Wildcat Captain",{4}{R}{W},Legendary Creature — Human Artificer Rogue,"Double strike, vigilance
Spells you cast have affinity for artifacts. (They cost {1} less to cast for each artifact you control.)",mythic,eoe,301
"Syr Vondam, Sunstar Exemplar",{W}{B},Legendary Creature — Human Knight,"Vigilance, menace
Whenever another creature you control dies or is put into exile, put a +1/+1 counter on Syr Vondam and you gain 1 life.
When Syr Vondam dies or is put into exile while its power is 4 or greater, destroy up to one target nonland permanent.",rare,eoe,302
Beyond the Quiet,{3}{W}{W},Sorcery,Exile all creatures and Spacecraft.,rare,eoe,303
